{
  "$schema": "../../../../../tools/schemas/map.schema.json",
  "version": 1,
  "id": "board-3",
  "name": "Open Field",
  "description": "Radius-3 hex board, 37 tiles. Starter map.",
  "symmetry": "rotational-180",
  "ladderPosition": 1,
  "spawns": {
    "p1": {
      "q": -3,
      "r": 0
    },
    "p2": {
      "q": 3,
      "r": 0
    }
  },
  "hexes": [
    {
      "q": 0,
      "r": 0,
      "terrain": "stone"
    },
    {
      "q": -1,
      "r": 1,
      "terrain": "grass"
    },
    {
      "q": 0,
      "r": 1,
      "terrain": "grass"
    },
    {
      "q": 1,
      "r": 0,
      "terrain": "grass"
    },
    {
      "q": 1,
      "r": -1,
      "terrain": "grass"
    },
    {
      "q": 0,
      "r": -1,
      "terrain": "grass"
    },
    {
      "q": -1,
      "r": 0,
      "terrain": "grass"
    },
    {
      "q": -2,
      "r": 2,
      "terrain": "grass"
    },
    {
      "q": -1,
      "r": 2,
      "terrain": "grass"
    },
    {
      "q": 0,
      "r": 2,
      "terrain": "grass"
    },
    {
      "q": 1,
      "r": 1,
      "terrain": "grass"
    },
    {
      "q": 2,
      "r": 0,
      "terrain": "grass"
    },
    {
      "q": 2,
      "r": -1,
      "terrain": "grass"
    },
    {
      "q": 2,
      "r": -2,
      "terrain": "grass"
    },
    {
      "q": 1,
      "r": -2,
      "terrain": "grass"
    },
    {
      "q": 0,
      "r": -2,
      "terrain": "grass"
    },
    {
      "q": -1,
      "r": -1,
      "terrain": "grass"
    },
    {
      "q": -2,
      "r": 0,
      "terrain": "grass"
    },
    {
      "q": -2,
      "r": 1,
      "terrain": "grass"
    },
    {
      "q": -3,
      "r": 3,
      "terrain": "grass"
    },
    {
      "q": -2,
      "r": 3,
      "terrain": "grass"
    },
    {
      "q": -1,
      "r": 3,
      "terrain": "grass"
    },
    {
      "q": 0,
      "r": 3,
      "terrain": "grass"
    },
    {
      "q": 1,
      "r": 2,
      "terrain": "grass"
    },
    {
      "q": 2,
      "r": 1,
      "terrain": "grass"
    },
    {
      "q": 3,
      "r": 0,
      "terrain": "grass"
    },
    {
      "q": 3,
      "r": -1,
      "terrain": "grass"
    },
    {
      "q": 3,
      "r": -2,
      "terrain": "grass"
    },
    {
      "q": 3,
      "r": -3,
      "terrain": "grass"
    },
    {
      "q": 2,
      "r": -3,
      "terrain": "grass"
    },
    {
      "q": 1,
      "r": -3,
      "terrain": "grass"
    },
    {
      "q": 0,
      "r": -3,
      "terrain": "grass"
    },
    {
      "q": -1,
      "r": -2,
      "terrain": "grass"
    },
    {
      "q": -2,
      "r": -1,
      "terrain": "grass"
    },
    {
      "q": -3,
      "r": 0,
      "terrain": "grass"
    },
    {
      "q": -3,
      "r": 1,
      "terrain": "grass"
    },
    {
      "q": -3,
      "r": 2,
      "terrain": "grass"
    }
  ]
}