{
  "version": 1,
  "id": "ring-3",
  "name": "The Ring",
  "description": "Radius-3 ring with a hole in the middle, 18 tiles.",
  "symmetry": "rotational-180",
  "ladderPosition": 2,
  "spawns": {
    "p1": {
      "q": -3,
      "r": 0
    },
    "p2": {
      "q": 3,
      "r": 0
    }
  },
  "hexes": [
    {
      "q": -3,
      "r": 3,
      "terrain": "stone"
    },
    {
      "q": -2,
      "r": 3,
      "terrain": "stone"
    },
    {
      "q": -1,
      "r": 3,
      "terrain": "stone"
    },
    {
      "q": 0,
      "r": 3,
      "terrain": "stone"
    },
    {
      "q": 1,
      "r": 2,
      "terrain": "stone"
    },
    {
      "q": 2,
      "r": 1,
      "terrain": "stone"
    },
    {
      "q": 3,
      "r": 0,
      "terrain": "stone"
    },
    {
      "q": 3,
      "r": -1,
      "terrain": "stone"
    },
    {
      "q": 3,
      "r": -2,
      "terrain": "stone"
    },
    {
      "q": 3,
      "r": -3,
      "terrain": "stone"
    },
    {
      "q": 2,
      "r": -3,
      "terrain": "stone"
    },
    {
      "q": 1,
      "r": -3,
      "terrain": "stone"
    },
    {
      "q": 0,
      "r": -3,
      "terrain": "stone"
    },
    {
      "q": -1,
      "r": -2,
      "terrain": "stone"
    },
    {
      "q": -2,
      "r": -1,
      "terrain": "stone"
    },
    {
      "q": -3,
      "r": 0,
      "terrain": "stone"
    },
    {
      "q": -3,
      "r": 1,
      "terrain": "stone"
    },
    {
      "q": -3,
      "r": 2,
      "terrain": "stone"
    }
  ]
}